urls,names,bio,birth,death,place
"https://ru.wikipedia.org/wiki/%D0%90%D0%B1%D0%B0%D1%80%D0%B5%D0%BD%D0%BE%D0%B2,_%D0%90%D0%BD%D0%B0%D1%82%D0%BE%D0%BB%D0%B8%D0%B9_%D0%90%D0%BD%D0%B0%D1%82%D0%BE%D0%BB%D1%8C%D0%B5%D0%B2%D0%B8%D1%87","Абаренов, Анатолий Анатольевич","Анато́лий Анато́льевич Абаре́нов (10 июля 1938, Москва — 19 апреля 2021, Таруса, Калужская область, Россия) — советский и российский мультипликатор, художник-иллюстратор.",10 июля 1938(1938-07-10),19 апреля 2021(2021-04-19) (82 года),"Таруса, Калужская область, Россия"
"https://ru.wikipedia.org/wiki/%D0%90%D0%B2%D0%B4%D0%B5%D0%B5%D0%B2,_%D0%92%D0%BB%D0%B0%D0%B4%D0%B8%D0%BC%D0%B8%D1%80_%D0%91%D0%BE%D1%80%D0%B8%D1%81%D0%BE%D0%B2%D0%B8%D1%87","Авдеев, Владимир Борисович","Влади́мир Бори́сович Авде́ев  (24 марта 1962 — 5 декабря 2020) — российский писатель, публицист и создатель учения о «расологии», представляющего собой расовую теорию о решающем влиянии расовых различий и «превосходстве нордической расы» над другими. Состоял в редакционных коллегиях различных изданий, преимущественно расистской и националистической направленности, Совете координаторов Московской славянской языческой общины А. К. Белова[1], клубе славяно-горицкой борьбы[2].",24 марта 1962(1962-03-24),5 декабря 2020(2020-12-05) (58 лет),СССР Россия
"https://ru.wikipedia.org/wiki/%D0%90%D0%B3%D0%B0%D0%B5%D0%B2,_%D0%92%D0%B0%D1%85%D0%B0_%D0%90%D0%B1%D1%83%D0%B5%D0%B2%D0%B8%D1%87","Агаев, Ваха Абуевич","Ва́ха Абу́евич Ага́ев (15 марта 1953, Кзыл-Орда, Кзыл-Ординская область, Казахская ССР, СССР — 23 сентября 2020[3][4], Москва[1], Россия) — российский предприниматель и политический деятель, депутат Государственной думы Федерального собрания Российской Федерации VI и VII созывов от политической партии «КПРФ».",,"15 марта 1953(1953-03-15)Кзыл-Орда,Кзыл-Ординская область,Казахская ССР,СССР","23 сентября 2020(2020-09-23) (67 лет)Москва[1], Россия"
"https://ru.wikipedia.org/wiki/%D0%90%D0%BA%D0%BA%D1%83%D1%87%D1%83%D0%BA%D0%BE%D0%B2%D0%B0,_%D0%A0%D0%BE%D0%B7%D0%B0_%D0%A1%D0%B0%D0%B1%D0%B8%D1%80%D1%8C%D1%8F%D0%BD%D0%BE%D0%B2%D0%BD%D0%B0","Аккучукова, Роза Сабирьяновна","Роза Сабирьяновна Аккучукова (12 февраля 1950, Абзаково, СССР — 8 февраля 2021, Уфа, Россия[3]) — певица, народная артистка Башкортостана (2009).",12 февраля 1950(1950-02-12),8 февраля 2021(2021-02-08)[1][2] (70 лет),"Уфа, Россия"
"https://ru.wikipedia.org/wiki/%D0%90%D0%BA%D1%81%D1%91%D0%BD%D0%BE%D0%B2,_%D0%92%D0%B8%D1%82%D0%B0%D0%BB%D0%B8%D0%B9_%D0%95%D0%B2%D0%B3%D0%B5%D0%BD%D1%8C%D0%B5%D0%B2%D0%B8%D1%87","Аксёнов, Виталий Евгеньевич","Виталий Евгеньевич Аксёнов (21 марта 1931, Ростов-на-Дону, РСФСР, СССР — 16 октября 2020, Санкт-Петербург, Россия[1]) — советский и российский режиссёр-постановщик и сценарист. Заслуженный деятель искусств Российской Федерации (2008)[2].",21 марта 1931(1931-03-21),16 октября 2020(2020-10-16) (89 лет),"Санкт-Петербург, Россия"
"https://ru.wikipedia.org/wiki/%D0%90%D0%BB%D0%B5%D0%BA%D1%81%D0%B0%D0%BD%D0%B4%D1%80%D0%BE%D0%B2,_%D0%91%D0%BE%D1%80%D0%B8%D1%81_%D0%AE%D1%80%D1%8C%D0%B5%D0%B2%D0%B8%D1%87","Александров, Борис Юрьевич","Бори́с Ю́рьевич Александрóв (11 сентября 1947, Уфа, Башкирская АССР, РСФСР, СССР — 30 ноября 2020, Москва, Россия[1][2][3]) — советский и российский врач-терапевт, предприниматель, президент группы компаний «Ростагрокомплекс», создатель бренда «Б. Ю. Александров» по выпуску глазированных сырков высокого качества[4][5]. Писатель, трижды лауреат российской премии «Предприниматель года» (2004, 2006, 2007), вице-президент «Академии проблем качества РФ» и «Российской академии бизнеса и предпринимательства»[6].",11 сентября 1947(1947-09-11),30 ноября 2020(2020-11-30) (73 года),"Москва, Россия"
"https://ru.wikipedia.org/wiki/%D0%90%D0%BB%D0%B8%D0%BE%D0%BC%D0%B0%D1%80%D0%BE%D0%B2,_%D0%9C%D0%B0%D0%B3%D0%BE%D0%BC%D0%B5%D0%B4_%D0%90%D0%BB%D0%B8%D0%BE%D0%BC%D0%B0%D1%80%D0%BE%D0%B2%D0%B8%D1%87","Алиомаров, Магомед Алиомарович","Магомед Алиомарович Алиомаров (29 мая 1952, Тлярош, Чародинский район, Дагестанская АССР, РСФСР, СССР — 13 мая 2020 Махачкала, Дагестан, Россия) — советский борец, советский и российский тренер по борьбе, главный тренер женской сборной России по борьбе (2019—2020). Заслуженный тренер России.",мужской,Россия,вольная борьба
https://ru.wikipedia.org/wiki/%D0%90%D0%BC%D0%B2%D1%80%D0%BE%D1%81%D0%B8%D0%B9_(%D0%AE%D1%80%D0%B0%D1%81%D0%BE%D0%B2),Амвросий (Юрасов),"Архимандри́т Амвро́сий (в миру Алекса́ндр Игна́тьевич Юра́сов; 8 сентября или 10 сентября[1]. 1938, село Огни, Алтайский край — 7 мая 2020, Россия) — священнослужитель Русской православной церкви, проповедник и писатель, духовник православного общества «Радонеж». Основатель (1991) и духовный руководитель Введенского женского монастыря в Иванове.",10 сентября 1938(1938-09-10),7 мая 2020(2020-05-07) (81 год),"Иваново, Россия"
"https://ru.wikipedia.org/wiki/%D0%90%D0%BC%D0%B8%D1%80%D0%B4%D0%B6%D0%B0%D0%BD%D0%BE%D0%B2,_%D0%90%D1%80%D1%82%D1%91%D0%BC_%D0%90%D1%80%D0%BA%D0%B0%D0%B4%D1%8C%D0%B5%D0%B2%D0%B8%D1%87","Амирджанов, Артём Аркадьевич","Артём Аркадьевич Амирджанов (18 ноября 1945, Баку — 31 августа 2020, Омск) — советский футболист, советский и российский тренер; функционер.",Артём Аркадьевич Амирджанов,"31 августа 2020(2020-08-31) (74 года)Омск, Россия",СССР Россия
"https://ru.wikipedia.org/wiki/%D0%90%D0%BD%D0%B4%D1%80%D0%B5%D0%B5%D0%B2,_%D0%92%D0%BB%D0%B0%D0%B4%D0%B8%D0%BC%D0%B8%D1%80_%D0%90%D0%BB%D0%B5%D0%BA%D1%81%D0%B0%D0%BD%D0%B4%D1%80%D0%BE%D0%B2%D0%B8%D1%87_(%D1%83%D1%87%D1%91%D0%BD%D1%8B%D0%B9)","Андреев, Владимир Александрович (учёный)","Владимир Александрович Андреев (1951—2020) — советский и российский учёный, педагог и организатор науки, доктор технических наук (1992), профессор (1994). Заслуженный деятель науки Российской Федерации (2010). Ректор (2002—2016) и президент (2016—2020) Поволжского государственного университета телекоммуникаций и информатики.",2002,"Витевский, Владимир Борисович","Мишин, Дмитрий Викторович"
"https://ru.wikipedia.org/wiki/%D0%90%D0%BD%D1%82%D0%BE%D0%BD%D0%BE%D0%B2%D0%B0,_%D0%98%D1%80%D0%B8%D0%BD%D0%B0_%D0%90%D0%BB%D0%B5%D0%BA%D1%81%D0%B0%D0%BD%D0%B4%D1%80%D0%BE%D0%B2%D0%BD%D0%B0","Антонова, Ирина Александровна","Ири́на Алекса́ндровна Анто́нова (20 марта 1922, Москва — 30 ноября 2020[1], там же) — советский и российский учёный-искусствовед, специалист по итальянской живописи эпохи Возрождения, телеведущая. Директор (1961—2013)[2] и президент (2013—2020) Государственного музея изобразительных искусств имени А. С. Пушкина в Москве. Доктор искусствоведения.",Ирина Александровна Антонова,"Москва, РСФСР",30 ноября 2020(2020-11-30) (98 лет)
"https://ru.wikipedia.org/wiki/%D0%90%D0%BD%D1%82%D0%BE%D1%88%D0%BA%D0%B8%D0%BD,_%D0%9D%D0%B8%D0%BA%D0%BE%D0%BB%D0%B0%D0%B9_%D0%A2%D0%B8%D0%BC%D0%BE%D1%84%D0%B5%D0%B5%D0%B2%D0%B8%D1%87","Антошкин, Николай Тимофеевич","Николай Тимофеевич Антошкин (19 декабря 1942, Кузьминовка, Башкирская АССР — 17 января 2021, Москва[1]) — советский и российский военный и политический деятель. Генерал-полковник авиации (1994), военный лётчик 1-го класса, Заслуженный военный лётчик Российской Федерации (1993). Ликвидатор аварии на Чернобыльской АЭС, Герой Советского Союза (1986). Депутат Государственной Думы VI и VII созывов, член фракции «Единая Россия».",,"19 декабря 1942(1942-12-19)Кузьминовка, Фёдоровский район, Башкирская АССР, РСФСР, СССР","17 января 2021(2021-01-17) (78 лет)Москва, Россия"
"https://ru.wikipedia.org/wiki/%D0%90%D1%80%D0%B1%D0%B8%D1%82%D0%BC%D0%B0%D0%BD,_%D0%A0%D0%BE%D0%BC%D0%B0%D0%BD_%D0%AD%D0%BC%D0%B8%D0%BB%D1%8C%D0%B5%D0%B2%D0%B8%D1%87","Арбитман, Роман Эмильевич","Роман Эмильевич Арбитман (7 апреля 1962[1], Саратов — 18 декабря 2020[2], Саратов[3]) — русский прозаик, писатель-фантаст, литературный критик, педагог.","Рустам Станиславович Кац, Лев Гурский, Эдуард Бабкин, Аркадий Данилов, Андрей Макаров","Саратов, РСФСР, СССР",18 декабря 2020(2020-12-18)[2] (58 лет)
https://ru.wikipedia.org/wiki/%D0%90%D1%80%D0%BA%D0%B0%D0%B4%D0%B8%D0%B9_(%D0%90%D1%84%D0%BE%D0%BD%D0%B8%D0%BD),Аркадий (Афонин),"Епи́скоп Арка́дий (в миру Александр Петрович Афонин; 15 июля 1943, село Чекалино, Сергиевский район, Куйбышевская область — 3 июня 2021) — епископ Русской православной церкви на покое, епископ Южно-Сахалинский и Курильский (1993—1997, 1999—2001), епископ Томский и Асиновский (1997—1998).",29 декабря 1999 — 17 июля 2001,Ионафан (Цветков),Даниил (Доровских)
"https://ru.wikipedia.org/wiki/%D0%90%D1%81%D1%80%D0%B0%D1%82%D1%8F%D0%BD,_%D0%90%D1%80%D0%BF%D0%B8%D0%BA_%D0%90%D1%88%D0%BE%D1%82%D0%BE%D0%B2%D0%BD%D0%B0","Асратян, Арпик Ашотовна","Арпик Ашотовна Асратян (арм. Հասրաթյան Արփիկ Աշոտի; 25 июня 1950, Ереван — 27 марта 2020, Москва[1]) — советский и российский эпидемиолог, вирусолог, инфекционист, специалист в области вирусных гепатитов, доктор медицинских наук, профессор.",,,
"https://ru.wikipedia.org/wiki/%D0%90%D1%8E%D0%BF%D0%BE%D0%B2,_%D0%90%D0%B1%D1%80%D0%B5%D0%BA_%D0%98%D0%B4%D1%80%D0%B8%D1%81%D0%BE%D0%B2%D0%B8%D1%87","Аюпов, Абрек Идрисович","Абрек Идрисович Аюпов (22 февраля 1936, Юдинский район, Татарская АССР, РСФСР, СССР — 12 июня 2020, Москва) — советский и российский военачальник, учёный в области испытаний авиационной техники, вооружения и системных исследований в авиации. Заместитель главнокомандующего ВВС по вооружению — начальник вооружения (1989—1995).",22 февраля 1936(1936-02-22),12 июня 2020(2020-06-12) (84 года),"Москва, Россия"
"https://ru.wikipedia.org/wiki/%D0%91%D0%B0%D0%B1%D0%B8%D0%BD,_%D0%9D%D0%B8%D0%BA%D0%BE%D0%BB%D0%B0%D0%B9_%D0%90%D0%BD%D0%B4%D1%80%D0%B5%D0%B5%D0%B2%D0%B8%D1%87","Бабин, Николай Андреевич","Николай Андреевич Бабин (18 сентября 1944, Аромашево, Тюменская область — 3 июля 2021[1]) — российский государственный деятель, председатель Государственной Думы Ямало-Ненецкого автономного округа, член Совета Федерации от Ямало-Ненецкого автономного округа.","18 сентября 1944(1944-09-18)Аромашево, Тюменская область, РСФСР, СССР",Государственный аграрный университет Северного Зауралья,кандидат биологических наук
"https://ru.wikipedia.org/wiki/%D0%91%D0%B0%D0%B3%D0%B4%D0%B0%D1%81%D0%B0%D1%80%D0%BE%D0%B2,_%D0%9C%D0%B8%D1%85%D0%B0%D0%B8%D0%BB_%D0%90%D1%88%D0%BE%D1%82%D0%BE%D0%B2%D0%B8%D1%87","Багдасаров, Михаил Ашотович","Михаи́л Ашо́тович Багдаса́ров (арм. Միխայիլ Բաղդասարով; 23 мая 1945, Баку, АзССР — 3 мая 2021[2], Москва, Россия[3]) — советский, российский артист цирка — дрессировщик хищных животных, создатель многих цирковых программ, создатель и руководитель аттракционов «Давид Сасунский» и «Георгий Казначей», «Тигры-шоу», Заслуженный артист Армянской ССР (1980), Народный артист России (1997). Художественный руководитель Нижегородского государственного цирка имени Маргариты Назаровой (2012—2019).",Михаил Ашотович Багдасаров,"Баку, АзССР, СССР",3 мая 2021(2021-05-03) (75 лет)
"https://ru.wikipedia.org/wiki/%D0%91%D0%B0%D0%BA%D0%B8%D0%BD,_%D0%92%D0%BB%D0%B0%D0%B4%D0%B8%D0%BC%D0%B8%D1%80_%D0%93%D0%B0%D0%B2%D1%80%D0%B8%D0%BB%D0%BE%D0%B2%D0%B8%D1%87","Бакин, Владимир Гаврилович","Влади́мир Гаври́лович Ба́кин (3 августа 1946, с. Монастырское, Юрьянский район, Кировская область — 25 декабря 2020, г. Киров) — председатель Законодательного Собрания Кировской области[1].",,Владимир Александрович Костин (и. о.),
"https://ru.wikipedia.org/wiki/%D0%91%D0%B0%D0%BB%D0%BC%D1%83%D1%81%D0%BE%D0%B2,_%D0%AE%D0%BB%D1%8C%D0%B5%D0%BD_%D0%A1%D0%B5%D1%80%D0%B3%D0%B5%D0%B5%D0%B2%D0%B8%D1%87","Балмусов, Юльен Сергеевич","Юлье́н Серге́евич Ба́лмусов (6 июля 1940 (1940-07-06), Москва, СССР — 29 мая 2020, там же, РФ) — советский и российский актёр театра и кино. Заслуженный артист РСФСР (1982). Народный артист РФ (2002). Лауреат Государственной премии РСФСР имени К. С. Станиславского (1985).",Юльен Сергеевич Балмусов,"Москва, СССР",29 мая 2020(2020-05-29) (79 лет)
"https://ru.wikipedia.org/wiki/%D0%91%D0%B0%D1%80%D1%83%D0%BB%D0%B8%D0%BD,_%D0%90%D0%BB%D0%B5%D0%BA%D1%81%D0%B0%D0%BD%D0%B4%D1%80_%D0%9D%D0%B8%D0%BA%D0%BE%D0%BB%D0%B0%D0%B5%D0%B2%D0%B8%D1%87","Барулин, Александр Николаевич","Алекса́ндр Никола́евич Бару́лин (17 ноября 1944 — 24 июля 2021, Москва) — советский и российский лингвист, семиотик, организатор и первый декан Факультета теоретической и прикладной лингвистики Российского государственного гуманитарного университета[1][2], кандидат филологических наук (1985), доцент (1993).",17 ноября 1944(1944-11-17),Москва,СССР→ Россия
"https://ru.wikipedia.org/wiki/%D0%91%D0%B5%D0%B4%D0%BE%D0%B5%D0%B2,_%D0%92%D0%B8%D0%BA%D1%82%D0%BE%D1%80_%D0%94%D0%BC%D0%B8%D1%82%D1%80%D0%B8%D0%B5%D0%B2%D0%B8%D1%87","Бедоев, Виктор Дмитриевич","Виктор Дмитриевич Бедо́ев (26 марта 1947, Хумалаг, Северо-Осетинская АССР — 5 января 2021) — советский и российский живописец, дизайнер, педагог.",26 марта 1947(1947-03-26),5 января 2021(2021-01-05),Москва
"https://ru.wikipedia.org/wiki/%D0%91%D0%B5%D0%B9%D0%BD%D0%B5%D0%BD%D1%81%D0%BE%D0%BD,_%D0%90%D1%80%D0%BA%D0%B0%D0%B4%D0%B8%D0%B9_%D0%92%D0%BB%D0%B0%D0%B4%D0%B8%D0%BC%D0%B8%D1%80%D0%BE%D0%B2%D0%B8%D1%87","Бейненсон, Аркадий Владимирович","Арка́дий Влади́мирович Бейненсо́н (30 июля 1975, Москва — 12 июля 2020, Москва) — российский журналист, ведущий (до 2012 года) программы «Сетевой дозор», координатор (до апреля 2014 года) проекта «Окно в Россию».",30 июля 1975(1975-07-30),12 июля 2020(2020-07-12) (44 года),"Москва, Россия"
"https://ru.wikipedia.org/wiki/%D0%91%D0%B5%D0%BB%D0%BE%D1%86%D0%B5%D1%80%D0%BA%D0%BE%D0%B2%D1%81%D0%BA%D0%B8%D0%B9,_%D0%9C%D0%B8%D1%85%D0%B0%D0%B8%D0%BB_%D0%9B%D0%B0%D0%B7%D0%B0%D1%80%D0%B5%D0%B2%D0%B8%D1%87","Белоцерковский, Михаил Лазаревич","Михаи́л Ла́заревич Белоцерко́вский (8 октября 1944, Москва — 28 января 2021, Тверь) — российский театральный фотограф.",8 октября 1944(1944-10-08),28 января 2021(2021-01-28) (76 лет),"Тверь, Россия"
"https://ru.wikipedia.org/wiki/%D0%91%D0%B5%D0%BB%D1%8B%D0%B9,_%D0%92%D1%8F%D1%87%D0%B5%D1%81%D0%BB%D0%B0%D0%B2_%D0%92%D0%BB%D0%B0%D0%B4%D0%B8%D0%BC%D0%B8%D1%80%D0%BE%D0%B2%D0%B8%D1%87","Белый, Вячеслав Владимирович","Вячеслав Владимирович Белый (1 августа 1945, Термез — 20 мая 2020, Москва) — советский и российский физик, доктор физико-математических наук, лауреат Государственной премии РСФСР (1991, совместно с Ириной Веретенникофф и Юрием Климонтовичем), главный научный сотрудник ИЗМИРАНа, специалист по исследованиям нестационарных явлений в ионосфере радиофизическими методами.",1 августа 1945(1945-08-01),20 мая 2020(2020-05-20) (74 года),"Москва, Россия"
"https://ru.wikipedia.org/wiki/%D0%91%D0%BE%D0%B3%D0%B4%D0%B0%D1%88%D0%B8%D0%BD,_%D0%92%D0%BB%D0%B0%D0%B4%D0%B8%D0%BC%D0%B8%D1%80_%D0%98%D0%B2%D0%B0%D0%BD%D0%BE%D0%B2%D0%B8%D1%87","Богдашин, Владимир Иванович","Владимир Иванович Богдашин (14 марта 1952, Пугачёв, Саратовская область, РСФСР, СССР — 22 июля 2021, Москва, Россия) — советский и российский военачальник, контр-адмирал, Заслуженный специалист Вооружённых Сил СССР (1991).",14 марта 1952(1952-03-14),22 июля 2021(2021-07-22) (69 лет),"Москва, Россия"
"https://ru.wikipedia.org/wiki/%D0%91%D0%BE%D0%B3%D0%BE%D0%BB%D1%8E%D0%B1%D0%BE%D0%B2,_%D0%90%D0%BB%D0%B5%D0%BA%D1%81%D0%B0%D0%BD%D0%B4%D1%80_%D0%90%D0%BA%D0%B8%D0%BC%D0%BE%D0%B2%D0%B8%D1%87","Боголюбов, Александр Акимович","Александр Акимович Боголюбов (29 декабря 1934, Москва, СССР — 20 июля 2020[1], там же, Россия) — советский режиссёр кино- и мультипликационных фильмов.",29 декабря 1934(1934-12-29),20 июля 2020(2020-07-20) (85 лет),"Москва, Россия"
"https://ru.wikipedia.org/wiki/%D0%91%D0%BE%D0%B3%D0%BE%D0%BC%D0%BE%D0%BB%D0%BE%D0%B2,_%D0%9D%D0%B8%D0%BA%D0%BE%D0%BB%D0%B0%D0%B9_%D0%90%D0%BB%D0%B5%D0%BA%D1%81%D0%B5%D0%B5%D0%B2%D0%B8%D1%87","Богомолов, Николай Алексеевич","Никола́й Алексе́евич Богомо́лов (16 декабря 1950, Москва — 20 ноября 2020[1], там же) — советский и российский филолог и литературовед, профессор МГУ. Доктор филологических наук (1992), профессор (1994), заведующий кафедрой литературно-художественной критики и публицистики факультета журналистики МГУ (с 1994 года). Один из авторов «Большой российской энциклопедии».",16 декабря 1950(1950-12-16),20 ноября 2020(2020-11-20) (69 лет),"Москва, Россия"
"https://ru.wikipedia.org/wiki/%D0%91%D0%BE%D0%BD%D0%BD%D0%B5%D1%80,_%D0%90%D0%BB%D0%B5%D0%BA%D1%81%D0%B0%D0%BD%D0%B4%D1%80_%D0%A2%D0%B8%D0%BC%D0%BE%D1%84%D0%B5%D0%B5%D0%B2%D0%B8%D1%87","Боннер, Александр Тимофеевич","Алекса́ндр Тимофе́евич Бо́ннер (4 июня 1937, Иркутск — 8 декабря 2020, Москва[2], Москва) — советский и российский правовед, доктор юридических наук, профессор МГЮУ, заслуженный деятель науки Российской Федерации.",4 июня 1937(1937-06-04),8 декабря 2020(2020-12-08) (83 года),"Москва, Россия"
"https://ru.wikipedia.org/wiki/%D0%91%D0%BE%D1%80%D0%B8%D1%81%D0%BE%D0%B2,_%D0%9C%D0%B8%D1%85%D0%B0%D0%B8%D0%BB_%D0%91%D0%BE%D1%80%D0%B8%D1%81%D0%BE%D0%B2%D0%B8%D1%87","Борисов, Михаил Борисович","Михаи́л Бори́сович Бори́сов (настоящая фамилия Фишман-Борисов[3][4][5]; 8 февраля 1949, Москва — 19 сентября 2020, там же) — советский и российский режиссёр, телеведущий, актёр и театральный педагог. Заслуженный деятель искусств Российской Федерации (2000), профессор, кандидат психологических наук, заведующий кафедрой режиссуры Театрального института им. Б. Щукина, заведующий кафедрой эстрадного искусства Российского института театрального искусства, режиссёр-постановщик спектаклей и оперетт, с 1994 года и до своей смерти — был ведущим и художественным руководителем еженедельной всероссийской телевизионной лотереи «Русское лото».",,,
