urls,names,bio,birth,death,place
"https://ru.wikipedia.org/wiki/%D0%95%D0%B2%D1%82%D1%83%D1%88%D0%B5%D0%BD%D0%BA%D0%BE,_%D0%AE%D1%80%D0%B8%D0%B9_%D0%93%D1%80%D0%B8%D0%B3%D0%BE%D1%80%D1%8C%D0%B5%D0%B2%D0%B8%D1%87","Евтушенко, Юрий Григорьевич","Юрий Григорьевич Евтушенко (29 мая 1964, Новосибирск — 9 ноября 2020, Санкт-Петербург) — генерал-майор ВС РФ, начальник Центра по примирению враждующих сторон и контролю за перемещением беженцев в Сирии с января по июль 2018 года, заместитель командующего войсками Западного военного округа по военно-политической работе[2].",29 мая 1964(1964-05-29),9 ноября 2020(2020-11-09) (56 лет),"Санкт-Петербург, Россия"
"https://ru.wikipedia.org/wiki/%D0%95%D0%B3%D0%B8%D0%BD,_%D0%92%D0%BB%D0%B0%D0%B4%D0%B8%D1%81%D0%BB%D0%B0%D0%B2_%D0%98%D0%B3%D0%BE%D1%80%D0%B5%D0%B2%D0%B8%D1%87","Егин, Владислав Игоревич",13 апреля 1989(1989-04-13),Владислав Игоревич Егин,186 см,104 кг
"https://ru.wikipedia.org/wiki/%D0%95%D0%B3%D0%BE%D1%80%D0%BE%D0%B2,_%D0%91%D0%BE%D1%80%D0%B8%D1%81_%D0%A4%D1%91%D0%B4%D0%BE%D1%80%D0%BE%D0%B2%D0%B8%D1%87","Егоров, Борис Фёдорович",Премия фонда имени Д. С. Лихачева (2007),29 мая 1926(1926-05-29),3 октября 2020(2020-10-03) (94 года),"Санкт-Петербург, Россия"
"https://ru.wikipedia.org/wiki/%D0%95%D0%BB%D0%B8%D0%BD,_%D0%93%D0%B5%D0%BE%D1%80%D0%B3%D0%B8%D0%B9_%D0%90%D0%BD%D0%B0%D1%82%D0%BE%D0%BB%D1%8C%D0%B5%D0%B2%D0%B8%D1%87","Елин, Георгий Анатольевич","Георгий Анатольевич Елин (6 августа 1951, Москва — 18 марта 2021, там же[1]) — русский журналист, редактор и литератор. Член Союза журналистов (1980), Член Союза писателей СССР (1991), после разделения союзов — СП Москвы (c 1993).",,,
"https://ru.wikipedia.org/wiki/%D0%96%D1%83%D0%BA%D0%BE%D0%B2%D0%B0,_%D0%A1%D0%BE%D1%84%D1%8C%D1%8F_%D0%98%D0%B2%D0%B0%D0%BD%D0%BE%D0%B2%D0%BD%D0%B0","Жукова, Софья Ивановна","Софья Ивановна Жукова (1939, деревня Звягино, Нижегородская область, РСФСР — 29 декабря 2020, Хабаровск, городская больница №10) – российская серийная убийца, совершившая в период с 2005 по 2019 год три убийства. На момент последнего преступления ей было 80 лет. Является самой старой из серийных убийц в истории России и СССР[2]. В некоторых источниках утверждается, что Жукова частично употребляла своих жертв в пищу[3]. Умерла от коронавируса до суда[4]. Признана виновной посмертно[5].","«Баба Соня»,«Русская бабушка-потрошительница»,«Сонька Сипатая»","деревня Звягино, Горьковская область, РСФСР, СССР",Россия
"https://ru.wikipedia.org/wiki/%D0%97%D0%B0%D0%B3%D0%BE%D1%80%D1%83%D0%BB%D1%8C%D0%BA%D0%BE,_%D0%95%D0%B2%D0%B3%D0%B5%D0%BD%D0%B8%D0%B9_%D0%9F%D0%B5%D1%82%D1%80%D0%BE%D0%B2%D0%B8%D1%87","Загорулько, Евгений Петрович","Евгéний Петрóвич Загорýлько (26 августа 1942 — 3 апреля 2021) — советский и российский тренер по лёгкой атлетике (прыжок в высоту), заслуженный тренер СССР и РФ.",мужской,лёгкая атлетика,ЦСКА
"https://ru.wikipedia.org/wiki/%D0%97%D0%B8%D0%BC%D0%B8%D0%BD,_%D0%92%D0%B8%D0%BA%D1%82%D0%BE%D1%80_%D0%9C%D0%B8%D1%85%D0%B0%D0%B9%D0%BB%D0%BE%D0%B2%D0%B8%D1%87","Зимин, Виктор Михайлович","Виктор Михайлович Зимин (23 августа 1962, Диссос, Красноярский край — 23 ноября 2020, Москва[1]) — российский государственный и политический деятель.",,Алексей Лебедь,Михаил Развожаев (и. о.)Валентин Коновалов
"https://ru.wikipedia.org/wiki/%D0%97%D1%83%D0%B1%D0%BA%D0%BE%D0%B2%D1%81%D0%BA%D0%B8%D0%B9,_%D0%A1%D0%B5%D1%80%D0%B3%D0%B5%D0%B9_%D0%A0%D0%BE%D1%81%D1%82%D0%B8%D1%81%D0%BB%D0%B0%D0%B2%D0%BE%D0%B2%D0%B8%D1%87","Зубковский, Сергей Ростиславович","Сергей Ростиславович Зубковский (25 октября 1938, Симферополь — 7 июля 2021, Владимир) — советский и российский композитор, пианист, заслуженный деятель искусств России, профессор Владимирского государственного университета, председатель творческого объединения композиторов Владимирской области.",25 октября 1938(1938-10-25),7 июля 2021(2021-07-07) (82 года),"Владимир, Россия"
"https://ru.wikipedia.org/wiki/%D0%97%D1%83%D0%B9%D0%BA%D0%BE%D0%B2,_%D0%92%D0%BB%D0%B0%D0%B4%D0%B8%D0%BC%D0%B8%D1%80_%D0%9D%D0%B8%D0%BA%D0%BE%D0%BB%D0%B0%D0%B5%D0%B2%D0%B8%D1%87","Зуйков, Владимир Николаевич","Влади́мир Никола́евич Зу́йков (27 января 1935, Москва — 25 февраля 2021, там же) — советский, российский художник-постановщик и художник-мультипликатор, график, иллюстратор. Заслуженный художник РСФСР (1989).",27 января 1935(1935-01-27),25 февраля 2021(2021-02-25) (86 лет),"Москва, Россия"
"https://ru.wikipedia.org/wiki/%D0%98%D0%B2%D0%B0%D0%BD%D0%BE%D0%B2,_%D0%98%D0%B3%D0%BE%D1%80%D1%8C_%D0%92%D0%B0%D1%81%D0%B8%D0%BB%D1%8C%D0%B5%D0%B2%D0%B8%D1%87_(%D1%83%D1%87%D1%91%D0%BD%D1%8B%D0%B9)","Иванов, Игорь Васильевич (учёный)","И́горь Васи́льевич Ивано́в (2 июля 1937 — 30 марта 2021[1]) — советский и российский учёный-почвовед и историк науки, председатель Комиссии истории, философии и социологии почвоведения Общества почвоведов имени В. В. Докучаева, Заслуженный деятель науки РФ (1998), профессор (2006).[2].",2 июля 1937(1937-07-02),30 марта 2021(2021-03-30) (83 года),"Егорьевск, Московская область, Россия"
"https://ru.wikipedia.org/wiki/%D0%98%D0%B3%D0%BD%D0%B0%D1%82%D0%B5%D0%BD%D0%BA%D0%BE,_%D0%90%D0%BB%D0%B5%D0%BA%D1%81%D0%B0%D0%BD%D0%B4%D1%80_%D0%90%D0%BB%D0%B5%D0%BA%D1%81%D0%B0%D0%BD%D0%B4%D1%80%D0%BE%D0%B2%D0%B8%D1%87","Игнатенко, Александр Александрович","Алекса́ндр Алекса́ндрович Игнате́нко (2 февраля 1947, Красный Лиман, Сталинская (ныне Донецкая) область УССР, СССР — 24 января 2021, Москва, Россия[1]) — советский и российский исламовед, специалист по истории средневековой и современной арабской мусульманской философско-политической мысли, по религиозному экстремизму и терроризму. Доктор философских наук, профессор. Член Общественной палаты РФ (2006—2008).",2 февраля 1947(1947-02-02),24 января 2021(2021-01-24) (73 года),"Москва, Россия"
"https://ru.wikipedia.org/wiki/%D0%98%D0%B3%D0%BD%D0%B0%D1%82%D1%8C%D0%B5%D0%B2,_%D0%9C%D0%B8%D1%85%D0%B0%D0%B8%D0%BB_%D0%92%D0%B0%D1%81%D0%B8%D0%BB%D1%8C%D0%B5%D0%B2%D0%B8%D1%87","Игнатьев, Михаил Васильевич","Михаи́л Васи́льевич Игна́тьев (8 января 1962, д. Малые Торханы, Чебоксарский район, Чувашская АССР, РСФСР, СССР — 18 июня 2020, Санкт-Петербург, Россия[2]) — российский государственный и политический деятель. Глава Чувашской Республики (2010—2020).",,"должность учреждена, он сам как Президент Чувашской Республики",Олег Николаев
"https://ru.wikipedia.org/wiki/%D0%98%D0%B4%D1%80%D0%B8%D1%81%D0%BE%D0%B2,_%D0%A3%D0%BC%D0%B0%D1%80_%D0%AE%D1%81%D0%B8%D0%BF%D0%BE%D0%B2%D0%B8%D1%87","Идрисов, Умар Юсипович","Ума́р Юси́пович Идри́сов (тат. Ğөmər Yosıf uğlı İdrisov, Гомәр Йосыф улы Идрисов;1 января 1954 (1954-01-01), Горький, СССР — 8 ноября 2020, там же (Нижний Новгород), Россия[1]) — советский и российский мусульманский религиозный деятель. В 1993—2008 гг. — председатель Духовного управления мусульман Нижнего Новгорода и Нижегородской области (ДУМНО), заместитель председателя Духовного управления мусульман Европейской части России (ДУМЕР), сопредседатель Совета муфтиев России (СМР), полномочный представитель СМР в Приволжском федеральном округе, председатель Совета улемов ДУМНО, председатель Совета старейшин ДУМНО, президент Нижегородского центра мусульманской культуры (НЦМК), президент Фонда им. имама Абу Ханифы.",,"1 января 1954(1954-01-01)Горький, РСФСР, СССР","8 ноября 2020(2020-11-08) (66 лет)Нижний Новгород, Россия"
https://ru.wikipedia.org/wiki/%D0%98%D0%BE%D0%B2_(%D0%A2%D1%8B%D0%B2%D0%BE%D0%BD%D1%8E%D0%BA),Иов (Тывонюк),"Митрополит Иов (в миру Дмитрий Яковлевич Тывонюк; 6 ноября 1938, Почаев, Украинская ССР, СССР — 1 декабря 2020, Москва) — епископ Русской православной церкви, управлявший Челябинской и Златоустовской епархией (1996—2011; с 2000 года в сане митрополита).",27 декабря 1996 — 22 марта 2011,Феофан (Ашурков),5 октября 1994 — 27 декабря 1996
https://ru.wikipedia.org/wiki/%D0%98%D0%BE%D0%BD%D0%B0_(%D0%9A%D0%B0%D1%80%D0%BF%D1%83%D1%85%D0%B8%D0%BD),Иона (Карпухин),"Митрополит Ио́на (в миру Ю́рий Алексе́евич Карпу́хин; 13 июня 1941, Москва — 4 мая 2020, там же) — архиерей Русской православной церкви, бывший митрополит Астраханский и Камызякский.",25 октября 1992 года — 15 июля 2016 года,Русская православная церковь,Филарет (Карагодин)
"https://ru.wikipedia.org/wiki/%D0%98%D0%BE%D1%84%D1%84%D0%B5,_%D0%93%D1%80%D0%B8%D0%B3%D0%BE%D1%80%D0%B8%D0%B9_%D0%90%D0%B4%D0%BE%D0%BB%D1%8C%D1%84%D0%BE%D0%B2%D0%B8%D1%87","Иоффе, Григорий Адольфович",Григо́рий Адо́льфович Ио́ффе (3 апреля 1953 — 17 ноября 2020[2]) — украинский и российский политический деятель.,,Сергей Аксенов,должность учреждена
https://ru.wikipedia.org/wiki/%D0%98%D1%81%D0%B8%D0%B4%D0%BE%D1%80_(%D0%9A%D0%B8%D1%80%D0%B8%D1%87%D0%B5%D0%BD%D0%BA%D0%BE),Исидор (Кириченко),"Митрополи́т Иси́дор (в миру Николай Васильевич Кириченко; 25 мая 1941, Веймарн, Ленинградская область — 8 августа 2020, Краснодар) — епископ Русской православной церкви. Митрополит Екатеринодарский и Кубанский (1987—2020). Председатель Церковного суда Русской православной церкви (26 июня 2008 — 8 августа 2020).",12 мая 1987 — 8 августа 2020,Владимир (Котляров),Кирилл (Покровский) (в/у)Павел (Пономарёв)
"https://ru.wikipedia.org/wiki/%D0%9A%D0%B0%D0%B7%D0%B0%D1%80%D1%8F%D0%BD,_%D0%9C%D0%B8%D1%88%D0%B8%D0%BA_%D0%90%D0%B9%D1%80%D0%B0%D0%B7%D0%B0%D1%82%D0%BE%D0%B2%D0%B8%D1%87","Казарян, Мишик Айразатович","Мишик Айразатович Казарян (28 февраля 1948, Раздан — 7 апреля 2020, Москва[1]) — советский и российский физик, крупный специалист в области лазерной физики и оптики. Доктор физико-математических наук, профессор. Лауреат Государственной премии СССР в области науки и техники (1980), иностранный член Национальной академии наук Республики Армения[2]. Создатель самого яркого импульсно-периодического лазера для видимой области спектра.",28 февраля 1948(1948-02-28),7 апреля 2020(2020-04-07) (72 года),"Москва, Россия[1]"
"https://ru.wikipedia.org/wiki/%D0%9A%D0%B0%D0%BC%D0%B1%D1%83%D1%80%D0%BE%D0%B2%D0%B0,_%D0%9B%D0%BE%D1%80%D0%B8%D0%BD%D0%B0","Камбурова, Лорина","Лори́на Камбу́рова (болг. Лорина Камбурова, англ. Lorina Kamburova; 25 октября 1991[1], Варна — 27 мая 2021, Москва) — болгарская актриса и певица, известная по ролям в американских фильмах. Вокалистка группы Ross’N Lorina.",25 октября 1991(1991-10-25),27 мая 2021(2021-05-27) (29 лет),"Москва, Россия"
"https://ru.wikipedia.org/wiki/%D0%9A%D0%B0%D0%BC%D0%B5%D0%BD%D0%B5%D0%B2,_%D0%93%D0%B5%D0%BE%D1%80%D0%B3%D0%B8%D0%B9_%D0%9A%D0%B8%D1%80%D0%B8%D0%BB%D0%BB%D0%BE%D0%B2%D0%B8%D1%87","Каменев, Георгий Кириллович","Георгий Кириллович Каменев (16 марта 1960, Москва — 3 ноября 2020[1]	, там же) — российский математик, доктор физико-математических наук (2005), ведущий научный сотрудник ВЦ ФИЦ ИУ РАН, член Диссертационного совета ФУПМ МФТИ[2]. Также известен как священник, штатный клирик московского храма Богоявления Господня бывшего Богоявленского монастыря.",16 марта 1960(1960-03-16),3 ноября 2020(2020-11-03) (60 лет),"Москва, Россия"
"https://ru.wikipedia.org/wiki/%D0%9A%D0%B0%D0%BF%D1%83%D1%81%D1%82%D0%B8%D0%BD,_%D0%9D%D0%B8%D0%BA%D0%BE%D0%BB%D0%B0%D0%B9_%D0%93%D0%B8%D1%80%D1%88%D0%B5%D0%B2%D0%B8%D1%87","Капустин, Николай Гиршевич","Никола́й Ги́ршевич Капу́стин (22 ноября 1937, Горловка, УССР, СССР — 2 июля 2020, Москва)[1] — советский и российский композитор, джазовый пианист.",Николай Гиршевич Капустин,"Горловка, УССР, СССР",2 июля 2020(2020-07-02) (82 года)
"https://ru.wikipedia.org/wiki/%D0%9A%D0%B0%D1%81%D0%B0%D1%82%D0%BA%D0%B8%D0%BD,_%D0%9B%D0%B5%D0%BE%D0%BD%D0%B8%D0%B4_%D0%9B%D0%B5%D0%BE%D0%BD%D0%B8%D0%B4%D0%BE%D0%B2%D0%B8%D1%87","Касаткин, Леонид Леонидович","Леони́д Леони́дович Каса́ткин (30 декабря 1926, Фрунзе — 13 сентября 2020[1], Москва) — советский и российский лингвист, специалист по фонетике русского языка и диалектологии. Доктор филологических наук (1986), профессор МГУ (1993—2004), до 2012 года возглавлял отдел диалектологии и лингвистической географии Института русского языка им. В. В. Виноградова РАН (с 1998 года), до 2017 года работал в отделе современного русского языка.",30 декабря 1926(1926-12-30),13 сентября 2020(2020-09-13) (93 года),"Москва, Россия"
"https://ru.wikipedia.org/wiki/%D0%9A%D0%B0%D1%82%D0%B0%D0%B5%D0%B2%D0%B0,_%D0%95%D0%BB%D0%B5%D0%BD%D0%B0_%D0%93%D0%B5%D0%BE%D1%80%D0%B3%D0%B8%D0%B5%D0%B2%D0%BD%D0%B0","Катаева, Елена Георгиевна","Елена Георгиевна Катаева (урожд. Солякина; 14 июня 1956, Ленинград — 10 января 2021, Москва) — кандидат технических наук, доктор политических наук, доцент; ректор университета «Станкин».",,,
"https://ru.wikipedia.org/wiki/%D0%9A%D0%B0%D1%82%D0%B5%D0%BB%D1%8C%D0%BD%D0%B8%D1%86%D0%BA%D0%B8%D0%B9,_%D0%98%D0%B2%D0%B0%D0%BD_%D0%98%D0%B2%D0%B0%D0%BD%D0%BE%D0%B2%D0%B8%D1%87","Кательницкий, Иван Иванович","Иван Иванович Кательницкий (1946 — 4 июля 2021) — специалист в области сосудистой хирургии. Доктор медицинских наук, профессор. Заслуженный врач Российской Федерации. Заведующий кафедрой хирургии № 1 Ростовского медицинского университета. Член правления Всероссийского общества ангиологов и сосудистых хирургов и член исполкома ассоциации флебологов России.",,,
"https://ru.wikipedia.org/wiki/%D0%9A%D0%B0%D1%87%D0%B0%D0%BD,_%D0%92%D0%BB%D0%B0%D0%B4%D0%B8%D0%BC%D0%B8%D1%80_%D0%90%D0%BD%D0%B4%D1%80%D0%B5%D0%B5%D0%B2%D0%B8%D1%87","Качан, Владимир Андреевич","Влади́мир Андре́евич Кача́н (18 мая 1947, Ворошилов, Приморский край — 7 мая 2021, Москва) — советский и российский актёр, музыкант, писатель. Народный артист Российской Федерации (2004)[1].",Владимир Андреевич Качан,"Ворошилов, Приморский край, РСФСР, СССР",7 мая 2021(2021-05-07) (73 года)
"https://ru.wikipedia.org/wiki/%D0%9A%D0%B2%D0%B0%D1%81%D0%BD%D0%B8%D0%BA%D0%BE%D0%B2,_%D0%9C%D0%B8%D1%85%D0%B0%D0%B8%D0%BB_%D0%AE%D1%80%D1%8C%D0%B5%D0%B2%D0%B8%D1%87","Квасников, Михаил Юрьевич","Михаил Юрьевич Квасников (21 августа 1970 года, Москва — 2 июля 2021 года, Москва) — российский учёный, специалист в области лакокрасочных материалов, один из ведущих специалистов в области электроосаждения, профессор, доктор технических наук.",21 августа 1970(1970-08-21),2 июля 2021(2021-07-02) (50 лет),"Москва, Россия"
"https://ru.wikipedia.org/wiki/%D0%9A%D0%B5%D0%BB%D1%8C%D0%BD%D0%B5%D1%80,_%D0%92%D0%B8%D0%BA%D1%82%D0%BE%D1%80_%D0%95%D1%84%D0%B8%D0%BC%D0%BE%D0%B2%D0%B8%D1%87","Кельнер, Виктор Ефимович","Ви́ктор Ефи́мович Ке́льнер (23 февраля 1945, Москва — 24 февраля 2021, Санкт-Петербург) — советский и российский историк.",23 февраля 1945(1945-02-23),24 февраля 2021(2021-02-24) (76 лет),"Санкт-Петербург, Россия"
"https://ru.wikipedia.org/wiki/%D0%9A%D0%B8%D1%80%D1%81%D0%B0%D0%BD%D0%BE%D0%B2,_%D0%92%D0%BB%D0%B0%D0%B4%D0%B8%D0%BC%D0%B8%D1%80_%D0%98%D0%B2%D0%B0%D0%BD%D0%BE%D0%B2%D0%B8%D1%87","Кирсанов, Владимир Иванович","Влади́мир Ива́нович Кирса́нов (13 августа 1947 — 20 марта 2021) —  советский и российский эстрадный танцовщик (чечётка), хореограф, педагог. Заслуженный артист Российской Федерации (1995). Профессор Российского института театрального искусства (ГИТИС).",Владимир Иванович Кирсанов,"село Иваньково, Вышневолоцкий район, Тверская область, СССР",20 марта 2021(2021-03-20) (73 года)
"https://ru.wikipedia.org/wiki/%D0%9A%D0%BE%D0%B2%D0%B0%D0%BB%D1%8C,_%D0%92%D0%B8%D0%BA%D1%82%D0%BE%D1%80_%D0%A1%D1%82%D0%B0%D0%BD%D0%B8%D1%81%D0%BB%D0%B0%D0%B2%D0%BE%D0%B2%D0%B8%D1%87","Коваль, Виктор Станиславович","Ви́ктор Станисла́вович Кова́ль (29 сентября 1947, Москва — 1 февраля 2021, там же) — русский поэт, прозаик, художник, актёр кино. Известны также песни на его стихи, исполнявшиеся Андреем Липским.",29 сентября 1947(1947-09-29),1 февраля 2021(2021-02-01) (73 года),"Москва, Россия"
"https://ru.wikipedia.org/wiki/%D0%9A%D0%BE%D0%BB%D1%8C%D0%BA%D0%B0,_%D0%92%D0%B0%D1%81%D0%B8%D0%BB%D0%B8%D0%B9_%D0%92%D0%B0%D1%81%D0%B8%D0%BB%D1%8C%D0%B5%D0%B2%D0%B8%D1%87","Колька, Василий Васильевич","Василий Васильевич Колька (4 октября 1957, Виноградов, Закарпатская область — 23 апреля 2020[1], Мурманск) — российский учёный-геолог, заведующий лабораторией геологии и минерагении новейших отложений Геологического института КНЦ РАН, исследователь Кольского полуострова и Карелии, специализировался в геологии отложений четвертичного периода[2].",4 октября 1957(1957-10-04),23 апреля 2020(2020-04-23)[1] (62 года),"Мурманск, Россия"
"https://ru.wikipedia.org/wiki/%D0%9A%D0%BE%D0%BC%D0%BB%D0%B5%D0%B2,_%D0%90%D0%BD%D0%B4%D1%80%D0%B5%D0%B9_%D0%9F%D0%B5%D1%82%D1%80%D0%BE%D0%B2%D0%B8%D1%87","Комлев, Андрей Петрович","Андрей Петрович Комлев (7 мая 1947, Свердловск — 5 августа 2021, Екатеринбург) — советский и российский писатель, поэт, прозаик, переводчик, педагог и историк культуры. Член Союза писателей России (1992). Лауреат Премии имени П. П. Бажова (2003).",,,
"https://ru.wikipedia.org/wiki/%D0%9A%D0%BE%D0%BD%D0%BE%D0%BF%D0%BB%D1%91%D0%B2,_%D0%A1%D0%B5%D1%80%D0%B3%D0%B5%D0%B9_%D0%90%D0%BB%D0%B5%D0%BA%D1%81%D0%B0%D0%BD%D0%B4%D1%80%D0%BE%D0%B2%D0%B8%D1%87","Коноплёв, Сергей Александрович","Сергей Александрович Коноплёв (4 июля 1949, Ташкент — 23 ноября 2020, Тверь) — российский актёр театра, кино и телевидения. Окончил Театрально-художественный институт имени А. Н. Островского, актёрское и театроведческое отделения (Ташкент). Работал в Ташкентском государственном русском ТЮЗе, Рязанском театре драмы, Государственном русском академическом театре драмы им. Горького (Ташкент). С 1990 года — актёр Тверского ТЮЗа.",4 июля 1949(1949-07-04),23 ноября 2020(2020-11-23) (71 год),"Тверь, Россия"
